'admin_title_field';'field_display_title';'field_subtitle';'language';'field_tags_keywords';'field_product_categories';'field_season';'field_point_value';'field_markets';'field_why_there_s_only_one_html';'field_why_there_s_only_one_html_translated';'field_demonstration_html';'field_demonstration_html_translated';'field_benefits_html';'field_benefits_html_translated';'field_if_she_asks_share_html';'field_if_she_asks_share_html_translated';'field_perfect_partners_text html';'field_perfect_partners_text html_translated';'field_story_html';'field_customer_questions_html';'field_customer_questions_html_translated';'field_related_products';'field_image';;;;;;
';'<p>Bronze Goddess Powder Bronzer Light, Medium, Medium Deep, Deep Para mejores resultados, aplica con la Brocha 15 usando movimientos en forma de &ldquo;3&rdquo;-comenzando en el centro de la frente, deslizando alrededor del contorno de las mejillas, terminando en la barbilla. Para completar su iluminación dorada, aplica bronceador en el medio hacia debajo de su cuello y hacia las clavículas- es el toque final perfecto. İTIP! El bronceador no debe ser más de dos tonalidades más oscuras que el tono de la piel natural. Bronze Goddess Gelée Bronzer* Un bronceador en bálsamo liviano todo en uno que le proporciona a la piel luminosidad y un brillo de verano saludable. &iquest;Cómo usarlo?: Presione para que salga una pequeña cantidad en el dorso de la mano y aplique con la brocha para la base o la punta de los dedos y aplique para lograr un brillo general en todo el rostro. İNUEVO! Bronze Goddess Summer Glow Illuminator* Líquido translucido y liviano que ilumina instantáneamente las mejillas, pómulos, cejas o le brinda al rostro una iluminación general. Úsalo solo o en combinación con tu base de maquillaje favorita para añadir iluminación a la piel. İNUEVO! Bronze Goddess Summer Glow Multi-Palette* Ilumina, Define el Contorno y Rubor, esta paleta prove todas las tonalidades para esculpir y definir el &ldquo;look&rdquo; de la piel para un brillo natural y estilo ligeramente bronceado con un tono suavemente destellante. İNUEVO!Bronze Goddess Summer Glow Eyeshadow Palette* Tonalidades de verano y seducción. Una paleta de 6 tonalidades bronceadas para iluminar, definir y dramatizar sus ojos. Una brocha de aplicación de doble punta incluida. İNUEVO!Pure Color Lip and Cheek Summer Glow* El mejor accesorio para su maquillaje de verano. Un lado le brinda a sus mejillas y labios un puñado de color revitalizador para un brillo fresco. El otro lado, un gloss liviano con un brillo intenso que se puede usar solo o sobre su color para labios.</p>';;;'Need a phrase to help you link? Try:

"Because you love ___, I also want to show you ___."

Bronze Goddess Eau Fraîche Skinscent';'<p>&iquest;Necesitas una frase que te ayude a enlazar? Trata : &quot;Como le encanta ___, quiero demostrarle ___.&quot; Bronze Goddess Eau Fraîche Skinscent</p>';;;;;'assets/images/BG-MUCollection.jpg';;;;;;
'
Double Wear Infinite Waterproof Eyeliner-  es-PR';'
Double Wear';'Infinite Waterproof Eyeliner';'es';'double wear infinite waterproof eyeliner, double wear infinite, delineador de ojos a prueba de agua, infinite, infinite eyeliner, delineador de ojos a prueba de agua double wear, delineador a prueba de agua, delineador de ojos, double wear eyeliner, maquillaje, delineador, ojo, ojos';'Maquillaje';'Primavera 2016';25;;'Our first-ever automatic waterproof eyeliner that wears for 24 hours. Lasts through any type of weather, climate, or activity—even exercise. Built-in sharpener and smudge tip applicator gives you everything you need to create the line you want. ';'<p>Nuestro primer delineador de ojos automatico a prueba de agua que dura 24 horas. Perdura en cualquier clima, ambiente o actividad - hasta durante ejercicios. Con un sacapunta integrado y aplicador de precision le brinda todo lo que necesita para crear la línea que desea.</p>';'Freshly sharpen the pencil using the built-in sharpener. Draw a line on the back of her hand. Smudge part of the line with the smudge tip applicator to show how she can wear it as a smoky eyeliner. Then, spray the hand 3 times with water and lay tissue over it, gently patting the tissue into back of hand. Remove tissue to show her the waterproof, 24 hour wearing benefits. 

Soak a cotton ball with Take It Away Gentle Eye and Lip LongWear Makeup Remover and press into hand until the eyeliner is removed. 
';'<p>Saque punta al lápiz utilizando el sacapuntas integrado. Aplique una línea en el dorso de la mano de la clienta. Pase sobre la línea el lado de la brocha de difuminación para que ella pueda apreciar el efecto de delineador esfumado. Luego aplique agua con el roceador 3 veces y coloque un papel facial encima, suavemente deslizando el papel facial. Remueva el papel facial para que ella pueda apreciar que no se retira por su beneficio a prueba de agua y de duración de 24 horas.</p>';'1. Waterproof—It’s our first-ever 24-hour wearing, waterproof eyeliner. 

2.  Must-have shades—Available in new matte and pearl finishes. Matte eyeliners can be used in the waterline for added definition.  

3. Built-in tools—Sharpener allows you to create a precise, natural line. Smudge tip applicator creates a sultry, smoky look. 
';'<p>1. A Prueba De Agua&mdash;nuestro primer delineador de ojos de larga duración de 24 horas a prueba de agua. 2. Tonalidades Que Tienes Que Tener&mdash;Disponibles ahora en acabado perlado y mate. Los delineadores mate se pueden usar en la línea de agua para añadir definición. 3. Herramientas Incluidas&mdash;Saca Puntas te permite crear una línea precisa y natural. Punta de esponja en el aplicador para crear un estilo sofisticado y difuminado.</p>
';'• Sweat, humidity, and exercise resistant. 
• Weatherproof and suitable for hot and humid climates.
• Angled soft silicone smudge tip applicator curves to the natural shape of your eye for easy blending.
';'<p>&bull; Resistente al sudor, humedad y ejercicios. &bull; A prueba de agua y adecuado para climas húmedos y calientes. &bull; Aplicador de punta angular de suave silicón para curvear en la forma natural de su ojo para fácil difuminación.</p>

';'Need a phrase to help you link? Try:

"Because you love ___, I also want to show you ___."

Advanced Micro Cleansing Balm';'<p>&iquest;Necesitas una frase que te ayude a enlazar? Trata : &quot;Como le encanta ___, quiero demostrarle ___.&quot; Advanced Micro Cleansing Balm</p>';;;;;'assets/images/DW-WaterproofEyeliner.jpg';;;;;;
'
Double Wear Waterproof All Day Extreme Wear Concealer -  es-PR';'Double Wear Waterproof';'All Day Extreme Wear Concealer';'es';'double wear waterproof all day extreme wear concealer, double wear waterproof all day, waterproof concealer, extreme wear concealer, extreme, wear, concealer, waterproof, double wear concealer, double wear waterproof, eyes, all day concealer';'Maquillaje';'Primavera 2016';25;;'A waterproof, 24-hour wear concealer with an all-new liquid-light texture—never feels dry or heavy. One application gets you comfortably through your day—workouts, tears, heat or humidity. ';'<p>Un corrector de 24 horas de duración en una textura líquida liviana innovadora - nunca se siente seca o pesada. Una sola aplicación es suficiente para que dure todo el día - ejercicios - lágrimas, calor o humedad.</p>';'Apply a pin-sized amount of Double Wear Waterproof Concealer to back of hand and blend into skin. Wait 10 seconds until dry, then spray concealed area with 5 sprays of water. Lay tissue over hand and pat. Lift tissue off skin to show her the waterproofing, transfer-resistant benefits. 

Show her how to remove with our   Apply 1 pump to the back of her hand and lightly massage into skin. Have her watch as the concealer disappears!  
';'<p>Aplique una pequeña cantidad de Double Wear Waterproof Concealer al dorso de la mano y difumine. Epere 10 segundos a que seque, luego aplique agua con el roceador 5 veces y coloque un papel facial encima, suavemente deslizando el papel facial. Remueva el papel facial para que ella pueda apreciar que no se retira por su beneficio a prueba de agua y resistente a transferirse. Muéstrele cómo removerlo con nuestro Perfectly Clean aplicando un &quot;pump&quot; en el dorso de su mano en forma de masaje, muéstrele cómo el corrector entonces desaparece.</p>  ';'1. All-Day Stay—Our first-ever 24-hour wear concealer that doesn’t settle, crease, or streak. 

2. All-Day Wear—Waterproof, sweat-resistant, heat and humidity, and transfer resistant. 

3. All-Day Comfort—Feels comfortable and lightweight. 

• Finish: Natural matte
• Oil-free
• 11 Shades
';'<p>1. Duración Todo El Día&mdash;Nuestro primer corrector de 24 horas de duración que no se corre, deteriora o acumula. 2. Todo El Día De Uso&mdash;A Prueba De Agua, resistente al sudor, calor y humedad, y resistente a transferirse. 3. Comodidad Todo El Día&mdash;Se siente cómodo y liviano. &bull; Acabado: Natural mate &bull; Libre De Aceite &bull; 11 Tonalidades</p>';'A protective, breathable, veil provides water-resistance and locks concealer into place for all day wear.

Hyaluronic Acid provides immediate hydration and comfort.
';'<p>Un velo de protección que respira provee beneficios resistentes al agua y sellar el corrector en su sitio para una durabilidad de 24 horas. El Acido Hialurónico provee hidratación inmediata y comodidad.</p>
';'Need a phrase to help you link? Try:

"Because you love ___, I also want to show you ___."

Advanced Micro Cleansing Balm';'<p>&iquest;Necesitas una frase que te ayude a enlazar? Trata : &quot;Como le encanta ___, quiero demostrarle ___.&quot; Advanced Micro Cleansing Balm</p>';;'"How do I use it?"
Apply a pin-sized amount to undereye area with a concealer brush or fingers. Pat to blend with ring finger. 

"How do I remove it?"
Soak a cotton ball with Take It Away Gentle Eye and Lip LongWear Makeup Remover. Gently remove in circular motions. 
';'<p>&quot;&iquest;Cómo la uso?&quot; Aplique una pequeña cantidad en el area debajo de los ojos con la brocha para corrector o los dedos. Aplique para difuminar con el dedo anular. &quot;&iquest;Cómo lo remuevo?&quot; Humedezca un algodón con Take It Away Gentle Eye and Lip LongWear Makeup Remover. Remueva en forma circular gentilmente.</p>
';;'assets/images/DW-WaterProofConcealer.jpg';;;;;;
'
Modern Muse Eau de Rouge-  es-PR';'Modern Muse';'Eau de Rouge';'es';'modern muse eau de rouge, modern muse, eau de rouge, modern, muse, eau de toilette, perfume, fragrancia,aroma, acordes duales, acordes, floral, florales, rosa floral, rosa, dewy rose, maderas  iridicentes, acordes';'Fragancias';'Primavera 2016';25;;'Introducing a fresh twist on Modern Muse Le Rouge. This eau de toilette embodies a romantic, flirtatious spirit that every woman can experience her own way. To one woman, it’s the delicate, flirty blend of Bourgeon de Cassis, Rose Centifolia, Rose Petals, and Dewy Green Notes. To another, it’s the dreamy combination of Jasmine, Vetiver, and Sheer Vanilla. Modern Muse Eau De Rouge is all about you—and how you feel when you wear it. ';'<p>Presentando una fresca versión de Modern Muse Le Rouge. Esta Agua de Tocador personifica un espíritu coqueto y romántico que cada mujer puede experimentar a su manera. Para una mujer, es su combinación coqueta y delicada de Bourgeon de Cassis, Rosa Centifolia, Pétalos de Rosa, y las notas verde de rocío. Para otra , es la combinación soñadora de Jasmines, Vetiver, y Vanilla. Modern Muse Eau De Rouge es todo sobre ti&mdash;y cómo te sientes cuando la usas.</p>';'Spray Modern Muse Eau De Rouge on a blotter card. As she experiences the scent, describe both accords and ask which one she’s drawn to.
 
Dewy Rose Accord—Rose Centifolia and Rose Petals combined with Dewy Green Notes add a youthful, fresh twist, while maintaining the original combination of Bourgeon de Cassis, feisty Pink Pepper and Raspberry of Modern Muse Le Rouge. 

Iridescent Woods Accord—A smooth blend of the original Jasmine, Magnolia, and Vetiver of Modern Muse Le Rouge, combined with Sheer Vanilla and Ambrette Seed for a soft, sweetly seductive scent. 

Fragrance Type: Floral Rose

';'<p>Aplique Modern Muse Eau De Rouge en un &quot;blotter&quot;. Mientras ella experimenta el aroma, describa sus dos acordes y pregúntele con cuál se identifica más. Acorde De Rosa De Rocío&mdash;Rosa Centifolia y Pétalos de Rosa combinados con Notas Verdes De Rocío añaden una versión juvenil y fresca mientras mantienen la combinación original de Bourgeon de Cassis, Pimienta Rosada y Frambuesa de Modern Muse Le Rouge. Acorde Maderas Iridiscente &mdash;Una suave combinación de Jasmín Clásico , Magnolia, y Vetiver de Modern Muse Le Rouge, combinado con Vanilla y Semillas de Ambar, para un aroma suave, dulce y seductor. Categoría de Fragancia: Floral Rosa</p>
';;;;;'Need a phrase to help you link? Try:

"Because you love ___, I also want to show you ___."
';'<p>&iquest;Necesitas una frase que te ayude a enlazar? Trata : &quot;Como le encanta ___, quiero demostrarle ___.&quot;</p>';;;;'Modern Muse Le Rouge';'assets/images/MM-EauDeRouge.jpg';;;;;;
'
New Dimension Firm Fill Eye System -  es-PR';'New Dimension';'Firm + Fill Eye System';'es';'new dimension firm fill eye system, new dimension, dimension, firm and fill, new dimension eye, eye system, eye creme, eye, new dimension system, firm, fill, firm fill, firm and fill eye, firm fill eye, firm fill eye system, firm and fill eye system, eyes, contoured eyes, eye contour, dark circles, creme filler, eye gel, firming, filling, filler';'Tratamiento';'Primavera 2016';25;;'Our first ever 2-step expert eye treatment firms and fills for a more contoured, younger-looking eye area. Eyes will instantly look transformed—smoother as lines and wrinkles are immediately filled. Over time, they look brighter, dark circles appear reduced, and eyes more lifted. ';'<p>Nuestro primer tratamiento experto de dos pasos para los ojos que brinda firmeza y rellena para un área de ojos de apariencia más juvenil y de más contorno. El área de los ojos se vera transformada instantáneamente- mas suave ya que las líneas y arrugas se rellenan inmediatamente. Con el tiempo se aclara, los círculos oscuros parecen reducirse y el área de los ojos se ve mas levantada.</p>';'Firm Step 1— Apply by placing 3 dots underneath your eye and then pat gently to blend. You can be generous with how much you apply.

Fill Step 2 — Apply only a pin-sized amount anywhere you see lines (Pro tip: smile to see exactly where they are.) Pat the creme into your skin using a rolling motion, working from the outer corner of the eye, in. Remember, a little goes a long way—use sparingly! 

And get real with these tips:

• If your eye area is dry, you can apply Advanced Night Repair Eye Serum first for an extra boost of hydration.
• For best results, when applying your concealer—use a brush or a clean fingertip with a patting motion. This will help keep the filler in place.
';'<p>Firmeza Paso 1 - Aplique 3 puntos debajo de los ojos y presione en aplicaciones suaves para difuminar. Puede ser generosa en su aplicación. Rellene Paso 2 &mdash; Aplique una mínima cantidad donde vea líneas (Tip de Expertos: sonría para apreciar exactamente dónde están). Presione gentilmente la crema en su piel con movimintos de rolo, desde la parte exterior del ojo hacia la interna. İRecuerda que una poca cantidad rinde muchísimo! Atiende estos consejos: &bull; Si tiene el área de ojos seca, puedes aplicar Advanced Night Repair Eye Serum primero para un impulso adicional de hidratación. &bull; Para mejores resultados, cuando aplicas el corrector - usa una brocha o la punta del dedo limpia en movimientos de palmaditas. Esto ayudará a mantener el rellenador en su sitio.</p>';'1. Firms—This ultra light, cushioning-gel gives an immediate tighter feeling while hydrating and firming the eye area. 

2. Fills—The expert creme filler firms and smoothes lines around the eye for a more contoured eye look. Plus, it can be applied anywhere else on the face you want to fill lines and wrinkles.
 
3. Transforms—Instantly, eyes look and feel smoother—as lines and wrinkles are immediately filled in. Over time, dark circles appear reduced, eyes look firmer and more lifted, and more contoured. The look of crepiness and puffiness is diminished.  
';'<p>1. Firmeza&mdash;Este gel ultra liviano acolchonado brinda una sensación de estiramiento inmediato mientras hidrata y reafirma el área de los ojos. 2. Rellenador&mdash;La Crema Rellenadora Experta reafirma y suaviza las líneas alrededor de los ojos para lograr una apariencia de contornos más definidos. Además se puede aplicar en cualquier área del rostro donde se quieran rellenar líneas y arrugas. 3. Transformación&mdash;Instantáneamente los ojos se ven y se sienten más suaves- ya que las líneas y arrugas se rellenan inmediatamente. Con el tiempo, las ojeras parecen reducirse, los ojos se ven más firmes y levantados, y con contornos más definidos. La apariencia de inflamación y deterioro disminuye.</p> 
';'New Dimension Firm + Fill Eye System Features:

VOLUME:

Shaping Technology helps restore natural-looking fullness and volume by supporting skin’s 3 natural skin plumpers (Hyaluronic Acid, Fillagrin and Lipids).

STRUCTURE:

1. With Pro-collagen Complex, this formula helps firm, tone, and give a more sculpted, lifted look around the eye area. 

Features Transformative Light-diffusing Optics. 

Together, it immediately smoothes plumps, brightens, and blurs for a visibly renewed look to the eye area. 
';'<p>New Dimension Firm + Fill Eye System Presenta: VOLUMEN: Tecnología De Forma ayuda a restaurar la apariencia natural de relleno y volumen apoyando los 3 soportes naturales de la piel (Ácido Hialurónico, Filagrina y Lípidos). ESTRUCTURA: 1. Con Complejo Pro-Colageno, esta fórmula ayuda a brindar firmeza , tonificar, y lograr una apariencia más definida y levantada en el área alrededor de los ojos. Incluye Ópticos de Transformación de Difusión de Luz. Juntos, inmediatamente suaviza, rellena, ilumina, y revitaliza para una apariencia visible renovada del área de ojos.</p>


';'Need a phrase to help you link? Try:

"Because you love ___, I also want to show you ___."

New Dimension Shape + Fill Expert Serum';'<p>&iquest;Necesitas una frase que te ayude a enlazar? Trata : &quot;Como le encanta ___, quiero demostrarle ___.&quot; New Dimension Shape + Fill Expert Serum</p>';;'"How often can I use it?"
Use the complete system morning and evening around the eye area. 

"Who’s it for?"
Any customer looking for a more contoured eye look. 

"How does it fill?"
Together the Shaping Technology and Transformative Light-diffusing Optics immediately smoothes, brightens, and blurs for a visibly renewed look to the eye area. 

"Does the New Dimension Firm + Fill Eye System have the skin refinishers?"
No, it does not have the Skin Refinishers found in the New Dimension Shape + Fill Expert Serum, but it does feature the Shaping Technology. Skin is plumped with immediate, intensive moisture and helps brighten the look of the overall eye area.

"Why do we need two separate jars for the eye?"
New Dimension Firm + Fill Eye System is in two separate jars because it’s a 2-step eye treatment consisting of two unique formulas with distinct benefits. 
The first jar firms—this ultra light, pillowy-gel gives an immediate tighter feeling while hydrating and firming the eye area. The second jar fills—the expert creme filler firms and smoothes the eye area for a more contoured eye look. Together they transform—instantly, eyes look and feel smoother—as lines and wrinkles are immediately filled in. Over time, dark circles appear reduced, eyes look firmer and more lifted, and more contoured. The look of crepiness and puffiness is diminished.  

"Do I need to use an additional eye creme with it?"
No, it’s not necessary. This 2-step expert eye treatment is all you need for a more hydrated, firmer, and more contoured eye area. However, if she wishes to layer an additional eye creme she can. In that case, we recommend applying Advanced Night Repair Eye Serum.

"Can I layer it with Advanced Night Repair Eye Serum?"
Yes. New Dimension Firm + Fill Eye System can be layered over Advanced Night Repair Eye Serum. If your customer’s eye area appears dry, apply Advanced Night Repair Eye Serum first for an extra boost of hydration and repair. Then apply New Dimension Firm + Fill Eye System following steps below.

"Can I apply concealer on top New Dimension Firm + Fill Eye System?"
Absolutely. We recommend when applying concealer on top to use a formula that has more “slip” like Double Wear Stay-in-Place Flawless Wear Concealer. When you apply, we recommend using a Concealer Brush then apply using a patting motion versus a sweeping motion—you don’t want to move the Filler you just applied. If she would like to use her finger to apply her concealer, make sure she applies with a clean finger—you do not want to use the finger you just applied the Filler with.
';'<p>&quot;&quot;&quot;&iquest;Con cuánta frecuencia lo puedo usar?&quot;&quot; Use el sistema completo en la mañana y en la noche alrededor del área de los ojos. &quot;&quot;&iquest;Para quién es? &quot;&quot; Para cualquier clienta que quiera un área de los ojos con más contorno. &quot;&quot;&iquest;Cómo rellena?&quot;&quot; La tecnología de Forma en combinación con la de Ópticos De Transformación De Difusión de Luz inmediatamente suavizan para una apariencia renovada en el area de los ojos. &quot;&quot;&iquest;El New Dimension Firm + Fill Eye System tiene refinadores de piel? No, no tiene los refinadores de piel que se encuentran en el New Dimension Shape + Fill Expert Serum, pero sí tiene la Tecnología De Forma. La piel se rellena con hidratación inmediata intensiva y ayuda a iluminar la apariencia de la piel alrededor de los ojos. &quot;&quot;&iquest;Por qué necesitamos dos frascos para los ojos?&quot;&quot; New Dimension Firm + Fill Eye System están en dos frascos separados porque es un tratamiento de dos pasos para el área de los ojos que tienen dos fórmulas distintas y únicas con beneficios individuales cada una. El primer frasco brinda firmeza&mdash;este gel ultra liviano acolchonado brinda una sensación inmediata de firmeza mientras hidrata y reafirma el área de los ojos. El segundo frasco, rellena - esta crema rellenadora experta suaviza y reafirma el área de los ojos para una apariencia de contorno más definido. Juntos transforman - instantáneamente los ojos se sienten y se ven más- mientras las líneas y arrugas se rellenan inmediatamente. A largo plazo, las ojeras parecen reducir, los ojos se ven más firmes, levantados y con mejor contorno. La apariencia de deterioro e hinchazón disminuye. &quot;&quot;&iquest;Necesito usar una crema de ojos adicional con ésto?&quot;&quot; No, no es necesario. Este tratamiento experto para un área de ojos más hidratada, con mayor firmeza y mejor contorno . Sin embargo si deseara aplicar una crema de ojos adicional, lo puede hacer. En ese caso le recomendamos aplicar Advanced Night Repair Eye Serum. &quot;&quot;&iquest;Puedo aplicar Advanced Night Repair Eye Serum en conjunto ?&quot;&quot; Si. New Dimension Firm + Fill Eye System puede usarse encima de Advanced Night Repair Eye Serum. Si el área de los ojos de la clienta se ve seca , aplique Advanced Night Repair Eye Serum primero para un efecto adicional de hidratación y reparación. Luego aplique New Dimension Firm + Fill Eye System siguiendo los siguientes pasos. &quot;&quot;&iquest;Puedo aplicar el corrector sobre el New Dimension Firm + Fill Eye System?&quot;&quot; Definitivamente. Recomendamos que cuando aplique el corrector encima, use una formula que se deslice como Double Wear Stay-in-Place Flawless Wear Concealer. Recomendamos que use la brocha para el corrector en movimientos de depositar en vez de deslizar para no remover el rellenar que acaba de aplicar. Si ella prefiere usar su dedo para aplicar el corrector, asegúrese de que su dedo esté limpio - no quiere usar el mismo dedo con que aplicó el rellenador.</p>';;'assets/images/ND-Eye.jpg';;;;;;
'
New Dimension Plump Fill Expert Lip Treatment -  es-PR';'New Dimension';' Plump + Fill Expert Lip Treatment';'es';'new dimension plump fill expert lip treatment, new dimension plump and fill expert lip treatment, plump, plumping, plumper, fill, filler, lip contours, lip contour, lip, lip treatment, lip plumper, lip plumping, lip filler, expert treatment, expert lip, new dimension';'Tratamiento';'Primavera 2016';25;;'This first-of-its-kind expert 2-step lip treatment instantly fills to help visibly define the lip contour area and over time gives visible volume for smoother, fuller looking lip contours. Plus it will help prevent lipstick from feathering for up to 8 hours.';'<p>El primer tratamiento experto de dos pasos para los labios en su clase que instantáneamente rellena para ayudar a definir visiblemente el contorno de los labios y a largo plazo brindar volumen visible para un contorno de labios más voluminoso y suave. Además ayuda a prevenir que el labial se cuartee por hasta 8 horas.</p>';'Here’s how to apply to your customer:

1. Expert Filler: With lip brush, apply serum around perimeter of lips, along lip contour, and then blend in with fingertips. 

2. Expert Plumper: Apply balm directly to lips. 
Follow with lip color if desired.
