'admin_title_field';'field_display_title';'field_subtitle';'language';'field_tags_keywords';'field_product_categories';'field_season';'field_point_value';'field_markets';'field_why_there_s_only_one_html';'field_why_there_s_only_one_html_translated';'field_demonstration_html';'field_demonstration_html_translated';'field_benefits_html';'field_benefits_html_translated';'field_if_she_asks_share_html';'field_if_she_asks_share_html_translated';'field_perfect_partners_text html';'field_perfect_partners_text html_translated';'field_story_html';'field_customer_questions_html';'field_customer_questions_html_translated';'field_related_products';'field_image';;;;;;
Pure Color Envy Shimmer Palette-  es-PR';'Pure Color Envy ';'Shimmer Palette';'es';'pure color envy shimmer palette, shimmer palette, pure color shimmer palette, pure color shimmer, envy shimmer palette, envy palette, pure color, pure color envy, envy, shimmer, strobing powder, powder';'Maquillaje';'Primavera 2016';25;;'The ultimate strobing powder that lights up skin with a fresh, natural luminosity. This creamy powder formula features three highlighter shades that glide onto skin, creating a brightness that defines the natural contours of the face. ';'<p>El polvo iluminador para la piel que brinda frescura y luminosidad. Esta formula cremosa de polvo inclye tres tonalidades iluminadoras que se deslizan en la piel creando una iluminación que define los contornos naturales de su rostro.</p>';;;;;;;'Need a phrase to help you link? Try:

"Because you love ___, I also want to show you ___."
';'<p>&iquest;Necesitas una frase que te ayude a enlazar? Trata : &quot;Como le encanta ___, quiero demostrarle ___.&quot;</p>                                           ';;'"How do I use it?"
Sweep onto high points of the face where the sun or light would naturally hit—brush down center of forehead, nose, Cupid’s bow and chin. Add more on cheekbones.
';'<p>&quot;&iquest;Cómo lo uso?&quot; Apique en las áreas de puntos de altura del rostro, aquellas que la luz del sol le daría por naturaleza - aplique hacia el centro inferior y en la frente, nariz, huecos de cupido y barbilla. Aplique más en los pómulos.</p> 
';;;;;;;;
'
Pure Color Lip and Cheek MultiStick-  es-PR';'Pure Color';'Lip and Cheek MultiStick';'es';'pure color lip and cheek multistick, lip and cheek color, lip cheek color, multistick, lip and cheek multistick, pure color lip and cheek, pure color lip cheek, pure color multistick, lip, cheek, color, 2 in 1, two in one, 2-in-1, two-in-one';'Maquillaje';'Primavera 2016';25;;'This oil-infused creamy blush and lip in an easy-to-use stick gives skin a fresh flush of color and instant boost of radiance. Infused with antioxidants and nourishing oils, skin looks and feels smooth and moisturized.';'<p>Este rubor y labial cremoso fusionado con aceite en barra de fácil uso, brinda a la piel un color fresco y radiancia instantánea. Impregnado con antioxidantes y aceites hidratantes, la piel se ve y se siente suave e hidratada.</p>';'Clean hands and show her the 2-in-1 benefits—

1. Apply to Cheeks—Blend a small amount of color onto fingertips and press onto cheeks. 

2. Apply to Lips—Blend a small amount of color onto fingertips and lightly press the color into lips. 
';'<p>Limpie sus manos y demuestre los beneficios dos en uno - 1. Aplique en las mejillas&mdash;Difumine una pequeña cantidad de color en la punta de sus dedos y presione en las mejlllas. 2. Aplique en los labios&mdash;Difumine una pequeña cantidad de color en la punta de sus dedos y presione suavemente en sus labios.</p> 
';'1. 2-in-1—Gives cheeks and lips a flush of color for a fresh-looking overall radiance. 

2. Oil-Infused Moisture—Instantly smoothes, softens and moisturizes cheeks and lips with a healthy dose of color. 

3. Easy to Use—Weightless, creamy formula glides effortlessly onto cheeks and lips and can be easily blended with fingertips.
';'<p>1. 2-en-1&mdash;Le brinda a las mejillas y labios un toque de color para una apariencia fresca radiante. 2. Hidratación Impregnada de Aceite&mdash;Instantáneamente calma, suaviza e hidrata las mejillas y labios con una dosis saludable de color. 3. Fácil de Usar&mdash;Liviana, fórmula cremosa se desliza sin esfuerzo en las mejillas y labios y se difumina fácilmente con la punta de los dedos.</p>';'1. Infused with skin-loving ingredients, including nourishing oils, Hyaluronic Acid, and antioxidants Vitamin C and E to soften, soothe, and moisturize skin and lips. 

2. Available in four natural shades—from natural nude to pops of pink—to give all skintones a healthy glow. 
';'<p>1. Impregnado con ingredientes que miman la piel, incluyendo aceites nutritivos, Ácido Hialurónico y antioxidants Vitamina C y E para suavizar, calmar e hidratar la piel y los labios. 2. Disponible en cuatro tonalidades naturales- desde los nudes naturales hasta los rosas intensos &ndash; para brindar una iluminación saludable a todas las tonalidades de piel.</p>
';'Need a phrase to help you link? Try:

"Because you love ___, I also want to show you ___."
';'<p>&iquest;Necesitas una frase que te ayude a enlazar?Trata: &quot;Como le encanta ___, quiero demostrarle ___.&quot;</p>                                              ';;'"How do I use it?"

For Cheeks: Apply a quarter-sized amount of color to the apples of the cheeks. Blend up with fingers. 

For Lips: Blend a small amount of color onto index finger and press color onto lips with finger. 
';'<p>&quot';'&iquest';'Cómo lo uso?&quot';' Para mejillas: Aplique en el centro de las mejillas. Difumine con los dedos. Para labios: Aplique en dedo índice el color y presiónelo en los labios con el dedo.</p> ';;'assets/images/PCEnvyMultiStick.jpg';;;
'
Estée Lauder pleasures Aqua Florals -  es-PR';'Estée Lauder pleasures ';'Aqua Florals';'es';'estee lauder pleasures aqua florals, estee lauder pleasures, estee lauder aqua florals, pleasures aqua florals, pleasures, aqua florals, aqua, florals, fragrance, scent, perfume, watery floral';'Fragancias';'Primavera 2016';25;;'Take a quick getaway with new pleasures Aqua Florals. Experience the uplifting combination of Honeysuckle and crisp Freesia, blended with a refreshing Watery Accord and lush Leafy Greens. Peony, complemented by Lilac and velvety Jasmine blossoms, add a delicate floralcy. Soft Musk and creamy Ambrox linger on the skin like the gentle haze of sunlight against the sea. It’s the perfect spring escape. ';'<p>Disfruta de una corta escapada con el nuevo pleasures Aqua Florals. Siente la refrescante combinacion de madreselva y chispeante freesia, mezcladas con los acordes frescos y hojas verdes. Peonias complementadas por lirios y capullos de jazmines aterciopelados, añade un bouque . El Musgo suave y cremosa Ambrosia permanecen en la piel como los destellos de Sol en el mar. Es la perfecta escapada de Primavera.</p>';'Spray pleasures Aqua Florals onto a blotter. Share the inspiration behind the fragrance while she experiences it, and ask her which note she is most drawn to.';'<p>Aplique pleasures Aqua Florals en un papel probador. Comparta la inspiración detrás de la fragancia mientras ella la prueba, pregúntele cuál de sus notas le atrae más.</p>';'Top Notes: Honeysuckle, Freesia, Watery Accord, Leafy Green Notes

Middle Notes: Lilac, Jasmine, Peony 
Base Notes: Musk, Ambrox

Fragrance Type: Watery Floral
';'<p>Notas Iniciales: Madreselva, Fresia, Acorde de Agua, Notas de Hojas Verdes Notas Intermedias: Lilas, Jazmines, Peonías Notas Finales: Musgo, Ambrosia Categoría De Fragancia: Floral Acuosa</p>';;;'Need a phrase to help you link? Try:

"Because you love ___, I also want to show you ___."
';'<p>&iquest;Necesitas una frase que te ayude a enlazar? Trata: &quot;Como le encanta ___, quiero demostrarle ___.&quot;</p>                                         ';;;;'Estée Lauder Pleasures';'assets/images/PleasuresAqua.jpg';;;;;;
'
Re-Nutriv Radiant White Age Renewal Serum Concentrate -  es-PR';'Re-Nutriv Radiant White Age Renewal';'Serum Concentrate';'es';'re-nutriv radiant white age renewal serum concentrate, re-nutriv radiant white age renewal, re-nutriv radiant white, re-nutriv serum concentrate, radiant white serum concentrate, radiant white serum, serum concentrate, serum, concentrate, radiant white, white, age renewal, whitening, brightening, radiant, renewal, dark spots, spots, spot, dark spot, discoloration, white tuberose';'Tratamiento';'Primavera 2016';25;'NOT AVAILBLE IN LATAM';'Our most potent brightening serum—now with double the concentration of precious White Tuberose Extract. Dramatically reduces the look of dark spots and discolorations and restores skin’s natural porcelain translucency. ';'<p>Nuestro suero iluminador más potente - ahora con doble de la concentración del Extracto De Gardenia Blanca. Reduce dramáticamente la apariencia de manchas oscuras y decoloración y restaura la translucencia natural de la piel.</p>';'Apply to back of customer’s hand. Have her experience the luxurious texture and scent. Ask her to compare her hands to see the difference. Apply Re-Nutriv Radiant White Moisturizer over the Serum on her other hand to demonstrate the benefit of the moisturizer.  ';'<p>Aplique al dorso de la mano de la clienta. Permita que experimente la lujosa textura y aroma. Solicite que compare sus manos para ver la diferencia. Aplique Re-Nutriv Radiant White Moisturizer sobre el Suero en su otra mano para demostrar los beneficios del hidratante.</p>';'1. Renews—helps reveal more porcelain perfection and evenness.

2. Reduces—the look of dark spots and discoloration and helps prevent their reappearance. 

3. Restores—skin’s firmness and softens fine dry lines.
';'<p>1. Renueva&mdash;ayuda a revelar una perfección de &ldquo;porcelana&rdquo; y emparejamiento. 2. Reduce&mdash;la apariencia de manchas y decoloración y ayuda a prevenir que reaparezcan. 3. Restaura&mdash;la firmeza de la piel y suaviza líneas finas de resequedad.</p>

';'1.   Features double the concentration of precious White Tuberose*—cultivated from powerful yet gentle stem cell extract that is 100x more precious than traditional extracts. Helps to break the cycle of irritation that can cause dark spots and the look of discolorations. Plus, powerful anti-irritants, Licorice and Algae Extract, calm and soothe the look of skin.

2.   Infused with new White Meadowfoam Sea Oil and new age-fighting technology to help skin respond and recover from environmental assaults that in turn could lead to dark spots and uneven skintone. 

* Compared to previous Serum.
';'<p>1. Incluye doble concentración de Gardenia Preciosa* &ndash; cultivada del poderoso extracto de célula madre de planta que es 100 veces más exclusivo que los extractos tradicionales. Ayuda a detener el ciclo de irritación que causa las manchas y decoloraciones. Además, poderosos Anti-irritantes; Licorice y Extracto de Algas, calman y suavizan la apariencia de la piel. 2. Impregnado con el Nuevo Aceite Marino Blanco Meadowfoam y la nueva tecnología para combatir el envejecimiento para ayudar a que la piel responda y se recupere de los ataques del ambiente que a su vez son los que pueden resultar en manchas y piel de tono disparejo. * Comparado con el suero anterior.</p>';'Need a phrase to help you link? Try:

"Because you love ___, I also want to show you ___."
';'<p>&iquest;Necesitas una frase que te ayude a enlazar? Trata: &quot;Como le encanta ___, quiero demostrarle ___.&quot;</p>';;'"How do I use it?"

Apply AM and PM after lotion. Follow with Spot Corrector as desired, then moistruize. Avoid eye area. 
';'<p>&quot;&iquest;Cómo lo uso?&quot; Aplique AM and PM luego de la loción. Luego aplique Spot Corrector como desee, luego hidrate. Evite el área de los ojos.</p>
';;'assets/images/RN-RadWhiteSerum.jpg';;;;;;
'
Re-Nutriv Ultimate Diamond Revitalizing Mask Noir-  es-PR';'Re-Nutriv Ultimate Diamond ';'Revitalizing Mask Noir';'es';'re-nutriv ultimate diamond revitalizing mask noir, re-nutriv ultimate diamond, ultimate diamond, ultimate, diamond, revitalizing mask, revitalizing mask noir, mask noir, noir, mask, revitalize, re-nutriv mask, re-nutriv mask noir, re-nutriv revitalizing mask noir';'Tratamiento';'Primavera 2016';25;;'Introducing our most luxurious spa-inspired treatment ever. This two-step pampering ritual begins with an ultra soft dry brush that instantly helps re-energize skin. Infused with a concentrated level of our precious Black Diamond Truffle extract, this multi-benefit formula nourishes while helping to purify, detoxify and retexturize skin. With just one treatment skin looks and feels completely transformed. ';'<p>Presentando nuestro tratamiento inspirado en -SPA más lujoso. Este ritual de dos pasos para engreirse comienza con un cepillo en seco que reenergiza la piel instantáneamente. Impregnado con un nivel concentrado de nuestro extracto exclusivo Trufa Diamante Negro, esta formula de multibeneficios hidrata mientras ayuda a purificar , desintoxicar y retexturizar la piel. Con un solo tratamiento la piel se verá y se sentirá transformada.</p>';'First, demonstrate the silky soft brush* on the back of her hand, by massaging into skin with small circular motions. Explain how the dry massage helps to re-energize microcirculation. 
Next, using the golden spatula, apply the mask to the back of her hand and massage a thin layer into her skin. Let it set for 2-3 minutes as you describe the benefits of the Mask and the Ultimate Diamond Collection. 

With moistened tissue, saturate cotton ball with Re-Nutriv Softening Lotion to sweep any residue from back of hand.

Have her compare her hands to feel the difference. 

IMPORTANT—You must explain to every customer that the brush should NOT be dipped or applied with the mask as it will discolor or damage the brush. Refer to the how-to-care instructions in Customer Questions below. 
';'<p>Primero demuestre la suavidad de la brocha* al masajear el dorso de su mano con movimientos circulares. Explique cómo el masaje en seco ayuda a reenergizar la microcirculación. Luego, usando la espátula dorada , aplica la mascarilla al dorso de su mano en forma de masaje dejando una capa fina en su piel. Déjala aplicada de 2 a 3 minutos mientras describes los beneficios de la Mascarilla y la Colección Ultimate Diamond . Con un papel facial húmedo, satura un algodón con Re-Nutriv Softening Lotion para remover cualquier residuo que haya quedado en su mano. Solicítale que compare ambas manos para que sienta la diferencia. IMPORTANTE&mdash; Le tienes que explicar a cada clienta que la brocha no se debe introducir en ningún producto ni es para aplicar la mascarilla ya que ésto causaría descoloración y daño a la brocha. Refiérase a las instrucciones adjuntas de cómo cuidar la brocha.</p>
';'1. Re-energizes—Massage helps increase microcirculation, while mask instantly gives your skin a fresher, more luminous look. 

2. Refines—Minimizes the look of imperfections, helps detoxify skin and purifies the look of pores. Skin looks and feels smooth and flawless. 

3. Transforms—With just one treatment, skin looks restored,       renewed and radiant. Helps minimize the visible signs of skin fatigue. 
';'<p>1. Re-energiza&mdash;el masaje ayuda a aumentar la microcirculación, mientras la mascarilla instantáneamente brinda una apariencia a la piel más fresca y luminosa. 2. Refina&mdash;Minimiza la apariencia de imperfecciones, ayuda a desintoxicar la piel y purificar la apariencia de los poros. La piel se ve y se siente suave e impecable. 3. Transforma&mdash;Con solo un tratamiento, la piel se ve restaurada, renovada y radiante. Ayuda a minimizar las señales visibles de fatiga en la piel.</p>';'1. Silky soft brush and custom massage technique—along with the purifying mask—helps increase microcirculation and eliminates impurities in skin.

2. Retexturizing technologies with gentle, ultra-fine polishing beads helps sweep away dull, tired skin cells.

3. Nutrient-rich formula is infused with a concentrated level of our precious Black Diamond Truffle Extract—proven to help energize skin. 

Plus:
• Formulated with our patent-pending youth-sustaining technologies. 
• Features Refined 24 K Gold and South Sea Pearls. 
';'<p>1. Suave brocha sedosa y ténica personalizada de masaje con la mascarilla purificante ayudan a aumentar la microcirculación y eliminar impurezas de la piel. 2. Retexturizar technologías con suaves gránulos ultra delicados exfoliadores remueven la células muertas, opacas y cansadas de la piel. 3. Fórmula enriquecedora con nutrientes contiene un nivel concentrado de nuestro Extracto de Trufa De Diamante Negro &ndash; comprobado para ayudar a energizar la piel. Además: &bull; Formulado con nuestras tecnologias de sostenimiento de juventud pendientes de patente. &bull; Incluye Oro 24 K Refinado y Perlas Del Mar Del Sur.</p>
';'Need a phrase to help you link? Try:

"Because you love ___, I also want to show you ___."

Re-Nutriv Ultimate Diamond Transformative Energy Creme';'<p>&iquest;Necesitas una frase que te ayude a enlazar? Trata: &quot;Como le encanta ___, quiero demostrarle ___.&quot; Re-Nutriv Ultimate Diamond Transformative Energy Creme</p>                                     ';;'"Can customers use the brush to apply the mask?"
No—it is not recommended and it is very important that you explain this to every customer. The brush was intended to be applied to dry skin only. Using the brush to apply the mask will cause the brush bristles to discolor. In addition, if the customer cleans the brush by submerging it in water repeatedly over time, it will damage the brush—similar to caring for any type of makeup brush. 

"What instructions should I give my customers about caring for the brush?"
Explain to the customer that the brush should be applied to dry skin only. Explain that the dry brush should be wiped with tissue after each use. Periodically she should cleanse the ends of the bristles with mild soap and water by gently swirling the tips in your palm. Next, swirl the brush again—this time in water only—to remove any remaining soap. Do not submerge the brush in water. Air dry brush on its side. Allow to fully dry before reusing. 

"How do I clean the counter for demonstration purposes?"
After each use, spray tissue with hygienic spray. Lay tissue flat on a hard surface. Use gentle pressure, moving the brush in circular motions, to ensure only the ends of the bristles touch the tissue. Air dry brush on its side in an open environment, and allow to fully dry before reusing.

"Why is it called Mask Noir?"
Mask Noir translates to “black mask” referring to the striking jet-black color of the mask. 

"What makes the mask jet black?"  
The Bamboo Charcoal contributes to the striking jet-black color of the mask. This natural charcoal is known for its purifying and detoxifying powers.

"What makes this mask different from other masks on the market?"
Re-Nutriv Ultimate Diamond Mask Noir is a luxurious, spa-like experience you can create at home. First, the exclusive, silky soft custom brush has a cashmere-like feel that creates an ultra pampering and invigorating experience for your skin. The brush, along with our custom massage technique, help increase skin’s microcirculation. 
Re-Nutriv Ultimate Diamond Mask Noir is infused with a concentrated level of our precious Black Diamond extract—to  help re-energize the look of skin. It is a multi-benefit formula that nourishes while helping to purify, detoxify and retexturize skin. With just one treatment, skin looks and feels transformed.                           

"What is special about the brush?"
This ultra-luxurious brush was carefully selected for its silky, cashmere-soft feel. The brush was also meticulously designed with an ultra-dense set of fibers for an extremely pampering and unique sensorial experience. 

This ritual was inspired by the ancient therapy of "dry brushing" which is adapted from a traditional “body” technique, now for the first time for face. 
This silky soft brush combined with the innovative massage helps increase microcirculation, re-energize skin''s appearance and preps skin for the mask that follows.  

"Can I use the brush without the mask to increase micro-circulation?"
Yes, but for the optimal experience we recommend using the brush followed by the mask. 

"What nutrient and minerals are in the mask?"
The nutrient-rich blend is infused with key minerals such as Magnesium, Calcium, and Zinc.

"How do I use it?"
Use once a week following steps below:

Step 1: Dry brush on clean skin.
Use the brush dry, directly on clean skin*.

Chin and Cheek 
Using small circulating motions, massage from chin, along jaw, to bottom of ear—twice. Next, massage from sides of nose, across cheek to temple—twice. Repeat on other side of the face. 

Tip to Temple
Sweep brush from tip of nose to forehead, then use the small circular motion to massage above eyebrow, moving toward temple. Do this twice, and then repeat on other side of face. 

Up and Over
In one continuous motion, sweep brush from tip of nose up and over eyebrow, down side of face and neck to collarbone. Repeat on other side. Wipe brush with tissue.  

*Important: For best results, the brush should only be used dry, directly on your skin. Never apply the mask with the brush as the massage effect will be diminished and bristles will become discolored.

Step 2: Apply Mask Noir.
Next use the golden spatula to scoop desired amount of the mask out of the jar. Applying with your fingertips, smooth a thin layer over your skin. Wait 5 minutes, and then with warm water, gently massage with your fingertips, using a small circular motion and moving from the center of the face toward the outer edge. Avoid eye area. 

Rinse with warm water, then use a cotton ball to sweep on Re-Nutriv Softening Lotion or preferred toning or treatment lotion. Follow with the rest of your Re-Nutriv skincare ritual.
