'admin_title_field';'field_display_title';'field_subtitle';'language';'field_tags_keywords';'field_product_categories';'field_season';'field_point_value';'field_markets';'field_why_there_s_only_one_html';'field_why_there_s_only_one_html_translated';'field_demonstration_html';'field_demonstration_html_translated';'field_benefits_html';'field_benefits_html_translated';'field_if_she_asks_share_html';'field_if_she_asks_share_html_translated';'field_perfect_partners_text html';'field_perfect_partners_text html_translated';'field_story_html';'field_customer_questions_html';'field_customer_questions_html_translated';'field_related_products';'field_image';;;;;;
';'<p>Aquí aprenderás cómo aplicárselo a tu clienta: 1. Expert Filler: Con la brocha para labios , aplica el suero alrededor del perímetro de los labios, por el contorno de los labios y entonces difumina con la punta de los dedos. 2. Expert Plumper: Aplica el bálsamo directamente en los labios. Aplica entonces lápiz labial si lo desea.</p>';'1. Fills—Instantly helps visibly define the lip contour area with a rich infusion of light diffusing optics—fighting feathering for up to 8 hours and blurs fine lines around lips.

2. Plumps—Ultra-conditioning treatment balm hydrates and smoothes, for naturally fuller-looking lips. 

3. Transforms—This lip treatment works both around and on the lips for a truly comprehensive lip treatment. Lips have more visible volume, definition, and look younger. 
';'<p>1. Rellena&mdash;Instantáneamente ayuda visiblemente a definir el contorno del área de los labios con una rica infusión de ópticos de luz de difusión-combatiendo que se cuarteen por hasta 8 horas y desvaneciendo la apariencia de líneas alrededor de los labios. 2. Voluminosidad&mdash;Tratamiento en bálsamo ultra acondicionador hidrata y suaviza para unos labios naturales de apariencia más voluminosa. 3. Transformación&mdash;Este tratamiento para labios trabaja alrededor de los labios y en los labios para lograr un tratamiento completo para los labios. Los labios logran una apariencia visible de mayor volumen, definición y juventud.</p>';'New Dimension Plump + Fill Expert Lip Treatment Features:

VOLUME:

Shaping Technology helps restore natural-looking fullness and volume by supporting skin’s 3 natural skin plumpers (Hyaluronic Acid, Fillagrin and Lipids). 

STRUCTURE:

With Pro-collagen Complex, this formula helps give visible volume to the lip area contours.

Features Transformative Light-diffusing Optics 

This treatment helps restore natural-looking fullness and volume for more defined lip contours.
';'<p>New Dimension Plump + Fill Expert Lip Treatment Presenta: VOLUMEN: Tecnología De Forma ayuda a restaurar la apariencia natural de relleno y volumen apoyando los 3 soportes naturales de la piel (Ácido Hialurónico, Filagrina y Lípidos) ESTRUCTURA: 1. Con Complejo Pro-Colageno, esta fórmula ayuda a brindar volumen visible en el contorno del área de los labios . Incluye Ópticos de Transformación de Difusión de Luz. Este tratamiento ayuda a restaurar la apariencia natural del relleno y volumen para un contorno más definido en el área de los labios.</p>';'Need a phrase to help you link? Try:

"Because you love ___, I also want to show you ___."

Pure Color Envy Sculpting Lipstick';'<p>&iquest;Necesitas una frase que te ayude a enlazar? Trata : &quot;Como le encanta ___, quiero demostrarle ___.&quot; Pure Color Envy Sculpting Lipstick</p>';;'"How often can I use it?"
To use, apply the Expert Filler morning and evening around lip line. Then, apply the Expert Plumper directly to lips morning and evening, or as much as needed. Follow with lip color if desired.

"How does it fill the lip contour?"
The Expert Filler instantly and visibly smoothes the lip area creating more youthful looking contours with light-diffusing optics. Over time, the Pro-Collagen Complex and Shaping Technology creates smoother, more defined lip contours.
The Expert Plumper immediately hydrates lips for a smoother, fuller look. 

"What makes this different than any other lip treatment?"
It’s a unique, first-of-its-kind 2-step system lip treatment providing the customer with everything she needs for younger, smoother, fuller-looking lips. First, the Expert Filler defines her lip contour while the Expert Plumper, plumps lips with deep, comforting hydration. This lip treatment works both around (Expert Filler) and on the lips (Expert Filler), for a truly comprehensive lip treatment.

"Can I apply lip color on top of the treatment?"
Of course! Any lip color can be applied directly on top of the New Dimension treatment balm. However, if you are using a lip liner, we recommend applying the lip liner first, and then to apply the treatment balm—because of its incredible hydration and the moisture it gives lips it’s harder to apply lip liner on top. Then, follow with your lip color. 

"What is the scent?"
The Expert Plumper is fragrance-free and the Expert Filler is a delicate blend of jasmine and rose.
';'<p>&quot;&quot;&quot;&iquest;Con cuánta frecuencia puedo usarlo?&quot;&quot; Aplique el Expert Filler en la mañana y en la noche alrededor del borde de los labios. Luego aplique el Expert Plumper directamente en los labios . Seguido de color para los labios si desea. &quot;&quot;&iquest;Cómo rellena el contorno de los labios?&quot;&quot; El Expert Filler instantáneamente y visiblemente suaviza el área de los labios creando un contorno de apariencia más juvenil con ópticos de difusión de luz. A largo plazo el Complejo Pro-Colágeno y la Tecnología de Forma crean un contorno de labios más definido y suave. El Expert Plumper inmediatamente hidrata para unos labios más voluptuosos en apariencia y suavidad. &quot;&quot;&iquest;Qué hace que ésto sea distinto a otros tratamientos para los labios? &quot;&quot; Es un sistema de tratamiento para los labios único primero en su clase de dos pasos que le provee a las clientas con todo lo que necesitan para que sus labios luzcan más rellenos, suaves y jóvenes. Primero, el Expert Filler define el contorno de sus labios mientras el Expert Plumper, rellena los labios con hidratación profunda y calmante. Este tratamiento para los labios funciona alrededor y sobre los labios para lograr un tratamiento completo. &quot;&quot;&iquest;Puedo aplicar color sobre el tratamiento?&quot;&quot; &iexcl;Claro! Cualquier color se puede aplicar directamente sobre el New Dimension treatment balm. Sin embargo, si usa un delineador de labios, recomendamos que se aplique el delineador primero, y luego el tratamiento&mdash;debido a su increíble hidratación y la humedad que brinda es más difícil aplicar el delineador sobre el tratamiento. Luego aplique el color de labios. &quot;&quot;&iquest;Cuál es el aroma?&quot;&quot; El Expert Plumper no contiene fragancia y el aroma del Expert Filler es una combinación de delicado jazmín y rosas. &quot;</p>';'New Dimension Shape + Fill Expert Serum';'assets/images/ND-Lip.jpg';;;;;;
'
New Dimension Tighten Tone Neck/Chest Treatment- es-PR';'New Dimension';'Tighten + Tone Neck/Chest Treatment';'es';'new dimension tighten tone neck chest treatment, new dimension tighten tone, new dimension neck chest treatment, new dimension neck chest, new dimension neck and chest, neck and chest treatment, neck and chest creme, new dimension neck and chest creme, new dimension neck chest treatment, new dimension neck chest creme, tighten and tone, tighten tone, tighten and tone neck chest, tighten and tone neck chest treatment, tighten and tone neck chest creme, neck creme, chest creme, neck treatment, chest treatment, new dimension treatment, new dimension';'Tratamiento';'Primavera 2016';25;;'An expert treatment that visibly transforms your delicate neck and chest area. Instantly plumps with moisture, smoothing and brightening skin. Over time, it helps fight gravity—resulting in skin that looks firmer and more lifted. Plus, it features a unique massage tool for an enhanced application experience.';'<p>Un tratamiento experto que visiblemente transforma el área de su cuello y escote. Instantánamente rellena con hidratación brindando luminosidad e iluminación a su piel. A largo plazo, ayuda a luchar contra la gavedad - resultando en una piel que luce más firme y levantada. Además incluye una herramienta de masaje única para una experiencia enriquecedora.</p>';'First, ask your customer to apply the New Dimension Tighten + Tone Neck/Chest Treatment to one side of her neck. Ask her to feel the difference in texture and point out the instant brightness.

Then, use massager and demonstrate following the steps below:

1. Start at center of chest and glide up one side of neck to just under chin, then back to ear, then down to collarbone.

2. Sweep the massager back and forth across your upper chest in a shallow “smile” shape.

3. Finish by sweeping in a curving V shape from one shoulder to the other, dipping down in the center, then back. 
Clean the applicator thoroughly with tissue, making sure to remove all visible traces of the creme.
';'<p>Primero solicita que la clienta se aplique el Nuevo Dimension Tighten + Tone Neck/Chest Treatment a un lado de su cuello. Solicite que sienta la diferencia en textura y demuéstrale la luminosidad instantánea. Luego, usa el aplicador de masaje y demuestra los siguientes pasos: 1. Comienza en el centro del escote y desliza hacia arriba en un lado del cuello hasta la barbilla, luego hacia la oreja y luego hacia abajo hacia la clavícula. 2. Pase el masajeador hacia alfrente y hacia atras a través de su escote en forma de sonrisa superficial. 3. Termine deslizándolo en una forma de &quot;V&quot; de un hombro a otro profundizando en el centro, luego atrás. Limpie el aplicador completamente con papel facial , asegurándose de remover toda la crema.</p>';'1. Brightens—Evens and brightens the look of the entire delicate neck and chest area.

2. Plumps—Ultra-silky soft creme instantly plumps skin with intense moisture to smooth and transform the neck and chest area. 

3. Transforms—Over time, helps fight gravity by revealing skin’s firmer, more lifted appearance.
';'<p>1. Ilumina&mdash;Empareja e ilumina la apariencia de toda el área delicada de cuello y escote. 2. Rellena&mdash;Suave crema ultra sedosa instantáneamente rellena la piel con hidratación intense para suavizar y transformar el cuello y escote. 3. Transformación&mdash;Con el tiempo, ayuda a combatir la gravedad revelando una piel de apariencia más firme y levantada.</p>
';'New Dimension Tighten + Tone Neck/Chest Treatment Features:

VOLUME:

Shaping Technology helps restore natural-looking fullness and volume by supporting skin’s 3 natural skin plumpers (Hyaluronic Acid, Fillagrin and Lipids). 

STRUCTURE:

With Pro-collagen Complex, this formula helps give visible volume to neck/chest area.

Features Transformative Light-diffusing Optics 

This treatment helps restore natural-looking fullness and volume for more defined contours.
';'<p>New Dimension Tighten + Tone Neck/Chest Treatment Presenta: VOLUMEN: Tecnología De Forma ayuda a restaurar la apariencia natural de relleno y volumen apoyando los 3 soportes naturales de la piel (Ácido Hialurónico, Filagrina y Lípidos). ESTRUCTURA: Con Complejo Pro-Colágeno, esta fórmula ayuda a brindar firmeza , tonificar, y lograr una apariencia más definida y levantada en el área del cuello/escote. Incluye Ópticos de Transformación de Difusión de Luz. Este tratamiento ayuda a restaurar la apariencia del volumen y relleno de la piel para lograr contornos más definidos.</p>';'Need a phrase to help you link? Try:

"Because you love ___, I also want to show you ___."

New Dimension Shape + Fill Expert Serum';'<p>&iquest;Necesitas una frase que te ayude a enlazar? Trata : &quot;Como le encanta ___, quiero demostrarle ___.&quot; New Dimension Shape + Fill Expert Serum</p>';;'"How often can I use it?"
To use, apply morning and evening. Apply generously over neck and chest area with your fingertips. Then energize skin with the custom massager.

"Why can’t I use my New Dimension Shape + Fill Expert Serum on my neck?"
What additional benefits does the New Dimension Tighten + Tone Neck/Chest Treatment have?

The New Dimension Tighten + Tone Neck/Chest Treatment was specifically developed for the delicate neck and chest skin with a silky texture that easily spreads easily without any pulling or tugging.
 
It features the Shaping Technology and Pro-Collagen Complex first introduced with the New Dimension Shape + Fill Expert Serum, but also has specific benefits for the neck and chest like: reducing the appearance of horizontal neck lines and is extra comfortable and hydrating. In addition, it comes with a massage tool specifically developed for the neck/chest that helps to energize dull, dry skin and boosts microcirculation. 

"Does New Dimension Tighten + Tone Neck/Chest Treatment have the skin refinishers?"
No, it does not have the Skin Refinishers found in the Shape + Fill Expert Serum, but it does still have moisturizing and smoothing benefits. Plus, it features an intensive level of skin brighteners to help brighten and even out the look of skin tone on the neck and chest. 

"Can I use New Dimension Tighten + Tone Neck/Chest Treatment on my face?" 
It is not recommended. The New Dimension Tighten + Tone Neck/Chest Treatment was specially formulated for the delicate skin on your neck and chest. This formula has extra “slip” and emolliency so it doesn’t pull or tug on skin, especially as you apply with the innovative massage tool. That “slip” is not ideal/comfortable for facial skin. For facial skin, we recommend using New Dimension Shape + Fill Expert Serum and a custom-fit, targeted moisturizer for optimal benefits.

"Would a younger customer benefit from using New Dimension Tighten + Tone Neck/Chest Treatment?"
Yes, the neck and chest area is one of the key areas to show signs of aging—it’s never to early to extra care of this delicate skin.

"What is the scent?"
It’s the same addicting scent as New Dimension Shape + Fill Expert Serum—featuring uplifting and energizing notes of mandarin, melon, cucumber as well as delicate notes of rose and jasmine.
';'<p>&quot;&quot;&quot;&iquest;Con cuánta frecuencia puedo usarlo?&quot;&quot; Aplique mañana y noche. Aplique una cantidad generosa en el cuello y escote con sus dedos. Luego energice su piel con el aplicador de masaje. &quot;&quot;&iquest;Por qué no puedo usar mi New Dimension Shape + Fill Expert Serum en mi cuello?&quot;&quot; &iquest;Qué beneficios adicionales tiene el New Dimension Tighten + Tone Neck/Chest Treatment?&quot;&quot; The New Dimension Tighten + Tone Neck/Chest Treatment fue específicamente desarrollado para la piel de la delicada área del cuello y escote con una textura sedosa que se desliza fácilmente sin halar o incomodar. Incluye la Tecnología De Forma y el Complejo Pro-Colágeno que se introdujo primero con el New Dimension Shape + Fill Expert Serum, pero también tiene beneficios específicos para el cuello y el escote como : reducir la apariencia de líneas de cuello horizontales, es ultra hidratante y confortable. En adición trae un aplicador de masaje específicamente desarrollada para el cuello y escote que ayuda a energizar la piel seca, opaca e impulsa la microcirculación. &quot;&quot;&iquest;El New Dimension Tighten + Tone Neck/Chest Treatment tiene refinadores de piel?&quot;&quot; No, no tiene los refinadores de piel que se encuentran en el Shape + Fill Expert Serum, pero sí tiene los beneficios de hidratación y suavidad. . Además tiene un alto nivel de iluminadores de piel para yudar en la luminosidad y emparejar el tono de la piel del cuello y escote. &quot;&quot;&iquest;Puedo usar New Dimension Tighten + Tone Neck/Chest Treatment en mi rostro?&quot;&quot; No es recomendado. El New Dimension Tighten + Tone Neck/Chest Treatment fue específicamente formulado para la delicada piel del cuello y escote. Esta fórmula tiene una textura de deslice adicional y emoliencia distinta para que no hale y no cacumule mientras de desliza con el innovador aplicador de masaje. Esa textura no es ideal/cómoda para el rostro. Para la piel facial, recomendamos usar New Dimension Shape + Fill Expert Serum y el hidratante que atienda sus necesidades para beneficios óptimos. &quot;&quot;&iquest;Una clienta joven se beneficiaría de usar New Dimension Tighten + Tone Neck/Chest Treatment?&quot;&quot; Si, las áreas del cuello y escote son claves en demostrar signos de envejecimiento - nunca es muy temprano para darle una atención especial a esta piel tan delicada. &quot;&quot;&iquest;Dé qué es el aroma? &quot;&quot; Es el mismo aroma adictivo de New Dimension Shape + Fill Expert Serum&mdash;con notas energizantes de mandarina, melón y pepinillo así como también delicadas notas de rosas y jazmines. &quot;</p>';;'assets/images/ND-Neck-Chest.jpg';;;;;;
'
Pure Color Envy Sculpting Blush-  es-PR';'Pure Color Envy';'Sculpting Blush';'es';'pure color envy sculpting blush, pure color envy, sculpting blush, pure color envy blush, pure color, pure color blush, envy blush, blush, cheeks, makeup, color, sculpting, sculpt';'Maquillaje';'Primavera 2016';25;;'Pure Color Envy Sculpting Blush—a collection of luxurious lightweight textures and fresh radiant colors. Sculpt, define and brighten your cheeks in just one sweep. ';'<p>Pure Color Envy Sculpting Blush - una colección de lujosas texturas livianas y colores radiantes frescos. Esculpe, define e ilumina tus mejillas con una sola aplicación.</p>';'Offer to apply her blush with our I Heart Blush 3 Minute Beauty technique. If she wants a more sculpted look, add luminosity with our Strobing 3 Minute Beauty  technique. ';'<p>Ofrezca aplicar el rubor con nuestra técnica de belleza: Corazón Rubor de 3 Minutos. Si ella prefiere un estilo más definido, añada luminosidad con la Técnica Estroboscóbica</p>.';'1. Sculpting—Sweeps on sheer for a natural glow; builds for contoured definition.

2. Defining Shades—Fresh, radiant colors for every skintone to highlight and define cheeks.   

3. Nourishing Radiance—Powder feels soft, smooth and weightless, leaving skin with a subtle glow. 
';'<p>1. Esculpir&mdash;Se aplica en pinceladas para un brillo natural, aplica en capas para una definición de contorno más marcada. 2. Definiendo Tonalidades&mdash;Fresca, colores radiantes para cada tonalidad de piel para destacar y definir las mejillas. 3. Radiante Hidratación&mdash;Polvo se siente suave, cómodo y liviano dejando un brillo sutil en la piel.</p>
';'1. Advanced True VisionTM Technology—Sculpted pigments provide added color dimension for intense color in just one sweep of the brush. 

2. Light-enhancing pearls create luminous color in 2 finishes.

3. Contains an anti-oxidant complex of Cranberry and Goji Berry extracts.
';'<p>1. Tecnología Avanzada True VisionTM &mdash';'Pigmentos definidos proveen una dimensión adicional de color para lograr una tonalidad intensa con una sola aplicación de brocha. 2. Perlas de Luz Intensa crea color con luminosidad en 2 acabados. 3. Contiene un complejo anti-oxidante de Arándano y extractos de fresas Goji.</p>';'Need a phrase to help you link? Try:

"Because you love ___, I also want to show you ___."

Pure Color Envy Sculpting Lipstick';'<p>&iquest;Necesitas una frase que te ayude a enlazar? Trata: &quot;Como le encanta ___, quiero demostrarle ___.&quot; Pure Color Envy Sculpting Lipstick</p>                   ';;;;;;;;;;
'
Pure Color Envy Sculpting Gloss -  es-PR';'Pure Color Envy';'Sculpting Gloss';'es';'pure color envy sculpting gloss, pure color envy, pure color gloss, sculpting gloss, envy gloss, envy sculpting gloss, gloss, lip color, lip gloss, lipgloss, pure color envy lip, pure color lip, envy lip';'Maquillaje';'Primavera 2016';25;;'This new gloss sculpts lips with intense shine and color in just one stroke. Lips feel continuously moisturized. Luxurious lightweight texture leaves lips glossy—never tacky. ';'<p>Este nuevo brillo esculpe los labios con un intenso destello y color en una sola pincelada. Los labios se sienten hidratados constantemente. La lujosa textura liviana deja los labios brillosos - nunca incómodos.</p>';'Apply to the back of her hand with disposable applicator to show her the color and shine. Offer to apply using our Lip Perfector 3 Minute Beauty technique.    ';'<p>Aplique al dorso de su mano con un aplicador desechable para mostrale el color y brillo. Ofrezca aplicarle usando la Técnica de Belleza de 3 Minutos: Labios Perfectos.</p>';'1. Sculpting—Lips look sculpted, highlighted, and defined with intense, longwearing shine.

2. Hydrating—Lips feel continuously moisturized—always glossy but never tacky.

3. Luxurious—New paddle applicator feels soft to the touch and follows the natural curve of lips for perfect application. 
';'<p>1. Esculpir&mdash;Los labios se ven definidos, iluminados con brillo intenso. 2. Hidratar&mdash;Labios se sienten hidratados continuamente- siempre con brillo pero nunca incómodos. 3. Lujo&mdash;El nuevo aplicador se siente suave al tacto y sigue la curva natural de los labios para una aplicación perfecta.</p>
';'1. Advanced True VisionTM Technology—Sculpted pigments provide added color dimension for the most intense color in just one stroke. 

2. Moisture Complex—Time-released Moisture Complex with Hyaluronic Acid helps attract, capture, and seal in moisture for continuous hydration. 

3. Paddle applicator was designed with an oval shape and a center reservoir to easily build color. 
';'<p>1. Tecnología Avanzada True VisionTM &mdash; Pigmentos definidos proveen una dimensión adicional de color para lograr una tonalidad intensa con una sola aplicación de brocha. 2. Complejo de Hidratación- Complejo de Hidratación de acción de tiempo prolongado con Ácido Hialurónico que ayuda a atraer, capturar y sellar la humedad para una hidratación continua. 3. Aplicación en espátula diseñada en forma ovalada con una reserva en el medio para acumular fácilmente el color.</p>
';'Need a phrase to help you link? Try:

"Because you love ___, I also want to show you ___."

Pure Color Envy Sculpting Lipstick';'<p>&iquest;Necesitas una frase que te ayude a enlazar? Trata : &quot;Como le encanta ___, quiero demostrarle ___.&quot; Pure Color Envy Sculpting Lipstick</p>               ';;;;;'assets/images/PCEnvyLipGloss.jpg';;;;;;
'
Pure Color Envy Sculpting Lacquer -  es-PR';'Pure Color Envy';'Sculpting Lacquer';'es';'pure color envy sculpting lacquer, pure color envy, pure color gloss, sculpting lacquer, envy lacquer, envy sculpting lacquer, lacquer, lip color, lip lacquer, pure color envy lip, pure color lip, envy lip';'Maquillaje';'Primavera 2016';25;;'The color impact of a lipstick in a liquid, lightweight texture. Combines glass-like shine with the coverage of a lasting lipstick. Moisture rich. Addictive vanilla scent.';'<p>El impacto del color de un lápiz labial en un líquido, textura liviana. Combina el brillo del cristal con la cobertura de un lápiz labial de larga duración. Hidratación intensa. Aroma adictivo de vainilla.</p> ';'Apply to the back of her hand with disposable applicator to show her the color and shine. Offer to apply using our Lip Perfector 3 Minute Beauty technique.    ';'<p>Aplique al dorso de su mano con un aplicador desechable para mostrarle el color y brillo. Ofrezca aplicarle usando la Técnica de Belleza de 3 Minutos: Labios Perfectos.</p>';'1. Sculpting—Opaque, high-shine, saturated color sculpts and defines lips with intense, lasting color for fuller looking lips. 

2. Hydrating—Lightweight, moisture-rich formula keeps lips feel continuously moisturized. 

3. Luxurious—Exclusive paddle applicator applies the right amount of color in just two strokes—for perfectly defined lips every time.
';'<p>1. Esculpir &mdash;Saturado de color opaco, de brillo intense que esculpe y define los labios con color intense de larga duración para unos labios de apariencia voluptuosa. 2. Hidratar&mdash;Rica fórmula hidratante liviana mantiene los labios sintiéndose continuamente hidratados. 3. Lujo&mdash;La exclusiva espátula de aplicación logra la cantidad perfecta de color en solo dos pinceladas para unos labios perfectamente definidos cada vez.</p>
';'1. Advanced True VisionTM Technology—Sculpted pigments provide added color dimension for intense color in just one stroke. 

2. Moisture Complex—Time-released Moisture Complex with Hyaluronic Acid helps attract, capture, and seal in moisture for continuous hydration. 

3. Paddle applicator was designed with an oval shape and a center reservoir to easily build color. 
';'<p>1. Tecnología Avanzada True VisionTM &mdash; Pigmentos definidos proveen una dimensión adicional de color para lograr una tonalidad intensa con una sola aplicación de brocha. 2. Complejo de Hidratación- Complejo de Hidratación de acción de tiempo prolongado con Ácido Hialurónico que ayuda a atraer, capturar y sellar la humedad para una hidratación continua. 3. Aplicación en espátula diseñada en forma ovalada con una reserva en el medio para acumular fácilmente el color.</p>';'Need a phrase to help you link? Try:

"Because you love ___, I also want to show you ___."

Pure Color Envy Sculpting Lipstick';'<p>&iquest;Necesitas una frase que te ayude a enlazar? Trata : &quot;Como le encanta ___, quiero demostrarle ___.&quot; Pure Color Envy Sculpting Lipstick</p>                  ';;;;;'assets/images/PCEnvyLipLacquer.jpg';;;;;;
'
