'admin_title_field';'field_display_title';'field_subtitle';'language';'field_tags_keywords';'field_product_categories';'field_season';'field_point_value';'field_markets';'field_why_there_s_only_one_html';'field_why_there_s_only_one_html_translated';'field_demonstration_html';'field_demonstration_html_translated';'field_benefits_html';'field_benefits_html_translated';'field_if_she_asks_share_html';'field_if_she_asks_share_html_translated';'field_perfect_partners_text html';'field_perfect_partners_text html_translated';'field_story_html';'field_customer_questions_html';'field_customer_questions_html_translated';'field_related_products';'field_image';;;;;;
'
Advanced Night Micro Cleansing Balm - es-PR';'Advanced Night Micro Cleansing Balm';;'es';'advanced night micro cleansing balm, avanzado, de noche avanzada, micro limpiadora en bálsamo, limpiadora en bálsamo, limpiadora en bálsamo, limpiadora en bálsamo, limpiadora, limpiadora, bálsamo, micro limpiadora, bálsamo de noche avanzado, limpiadora, purificante, limpa, limpio, purifica, rostro, lavado de rostro, limpiar';'Tratamiento';'Primavera 2016';25;;'Like magic, this advanced formula melts from a balm to an oil—then transforms into a milky lotion. It removes all makeup—including eye makeup—plus the day’s impurities and pollution. 
Infused with soothing lavender and chamomile, it’s the perfect way to start your night ritual.  Skin feels deeply purified and conditioned.
';'<p>Como magia, esta avanzada fórmula se convierte de un bálsamo en un aceite - luego se transforma en una loción. Remueve todo el maquillaje- incluyendo el de ojos - además de las impurezas y contaminación. Impregnado con calmante lavanda y camomila, es la manera perfecta de comenzar su ritual de la noche. La piel se siente profundamente purificada y acondicionada.</p>';'• Apply a pea size amount of the Cleansing Balm onto the back of customer’s hand. 
• Massage balm over the hand; point out how the balm melts into a silky cleansing oil. 
• Ask customers to experience the soothing scent of lavender and chamomile.
• Next, spray water onto the hand and massage. 
• Notice how the oil transforms into a milky lotion with water.
• Use a tissue to wipe away. It’s important to point out that the balm has no greasy after feel.
• Compare hands. Point out the clarity and cushioned feel on cleansed hand.
';'<p>&bull; Aplique una pequeña cantidad de Cleansing Balm en la parte posterior de la mano de la clienta. &bull; Aplique en forma de masaje en su mano expresando cómo el bálsamo se convierte en un aceite limpiador sedoso. &bull; Solicite que la clienta sienta el aroma calmante de la lavanda y la camomila. &bull; Luego, rocíe agua en su mano y dé masaje en la mano. &bull; Note como el aceite se convierte en una rica loción con el agua. &bull; Utilice un papel facial para remover. Es importante enfatizarle a la clienta que la loción no deja sensación de grasa en la piel. &bull; Compare las manos. Enfatice la claridad y la sensación acolchonante en la mano limpia.</p>';'1. Micro-Purifying—Gently and quickly “takes your entire day off”—including long wear makeup, impurities and pollution. Used regularly, it helps clear pores for a more refined, smoother look. 

2. Micro-Revitalizing—Gentle formula revitalizes with skin conditioners and a relaxing blend of lavender and chamomile to help calm and soothe the senses.

3. Micro-Nourishing—Infused with a concentration of micronutrients and minerals that help to deeply nourish, balance and condition the look of skin.
';'<p>1. Micro-PurificadorSuavemente y rápidamente &quot;remueve el día entero de encima&quot; &mdash;incluyendo maquillaje de larga duración, impurezas y contaminación.Usado regularmente, ayuda a aclarar los poros para una apariencia más refinada y suave. 2. Micro-Revitalizador&mdash;Fórmula suave que revitaliza con acondicionadores de piel y una relajante combinación de lavanda y camomila para ayudar a calmar y suavizar los sentidos. 3. Micro-Nutritiva&mdash;Infusionado con una concentración de micronutrientes y minerales que ayudan a nutrir profundamente, balancear y condicionar la apariencia de la piel.</p>
';'Key technologies:

Created specifically for use at night, this gentle yet powerful cleansing foam is formulated with Essential Skin Minerals, Safflower Seed Oil and Lady’s Thistle that deeply purify, balance and condition skin.
';'<p>Technologías Claves:</p><p>Creado específicamente para usarse de noche, esta poderosa pero gentil&nbsp; limpiadora en bálsamo está formulada con Minerales Esenciales Para La Piel,&nbsp; Aceite De Semilla De Cártamo y&nbsp; Y Lady&rsquo;s Thistle que purifican profundamente, balancean y acondicionan la piel.</p>';'Need a phrase to help you link? Try:

"Because you love ___, I also want to show you ___."

Advanced Night Repair Synchronized Recovery Complex II';'<p>&iquest;Necesitas una frase que te ayude a enlazar?  Trata : &quot;Como le encanta ___, quiero demostrarle ___.&quot; Advanced Night Repair Synchronized Recovery Complex II</p>';;'"Who is it for?" 
All skin types, even oily skin types.

"How do I use it?" 
Use every night. Massage balm over dry skin, including closed eyes. Add water to transform into a milky lotion. Rinse with warm water.

"Can I use the Advanced Night Micro Cleansing Balm in the morning?"
Yes. While the Advanced Night Micro Cleansing Balm was specifically designed for night to help remove makeup, impurities and pollution it is gentle enough to be used in the morning should a customer wish to. 

"Why are we calling it a micro cleanser?"
The Advanced Night Micro Cleansing Foam and Balm work to remove makeup, dirt, debris and pollution that are micro sized and may not been easily seen.
';'<p>&quot;&iquest;Para quién es?&quot; Todo tipo de piel, incluyendo piel grasa. &quot;&iquest;Cómo lo uso?&quot; Uselo cada noche. Aplique el bálsamo en la piel seca, incluyendo , los ojos cerrados. añada agua para transformar en una rica loción. Enjuague con agua tibia. &quot;&iquest;Puedo usar el Advanced Night Micro Cleansing Balm en la mañana?&quot; Si. Aunque el Advanced Night Micro Cleansing Balm fue especificamente disenado para la noche para ayudar a remover el maquillaje, las impurezas y la contaminación, es suficientemente suave para usarse en la mañana si la clienta lo desea. &quot;&iquest;Por qué lo estamos llamando un micro limpiador??&quot; El Advanced Night Micro Cleansing Foam and Balm trabaja para remover maquillaje , sucio, impurezas y contaminación que tienen un tamaño microscópico que no se puede ver fácilmente.</p>
';;'assets/images/ANR-CleansingBalm.jpg';;;;;;
'
Advanced Night Micro Cleansing Foam - es-PR';'Advanced Night Micro Cleansing Foam';;'es';'advanced night micro cleansing foam, avanzado, de noche avanzado, espuma micro limpiadora, espuma limpiadora, limpiadora, espuma, micro limpiadora, espuma de noche avanzada, limiadora espumosa, limpiadora, purificadora, limpia, limpio, purifica, rostro, lavado de rostro, limpiar';'Tratamiento';'Primavera 2016';25;;'This advanced conditioning cleanser transforms into a soft, airy foam that removes all makeup and impurities, including pollution. Infused with soothing lavender and chamomile–it’s the perfect way to start your night ritual.  Skin feels deeply purified and conditioned.';'<p>Esta limpiadora avanzada acondicionadora, se transforma a una suave espuma liviana que remueve todo el maquillaje e impurezas, inclyendo la contaminación. Impregnada con calmante lavanda y camomila - es perfecta para comenzar su ritual de la noche. La piel se siente profundamente purificada y acondicionada.</p>';'• Spray back of customer’s hand with water to dampen skin. Apply a pea size amount of the Advanced Night Micro Cleansing Foam and massage onto the back of customer’s hand. 
• Ask customers to experience the soothing lavender and chamomile scent. 
• Next, spray water onto the hand and massage to create foam.
• Use tissue to wipe away. Follow with another spray of water to “rinse” and pat dry with tissue.
• Compare hands. Point out the soft, clean and conditioned feel of hand.
';'<p>&bull; Vierta agua con el atomizador en la mano de la clienta para humedecerla. Aplique una pequeña cantidad de Advanced Night Micro Cleansing Foam en forma de masaje en la parte posterior de su mano. &bull; Solicite que la clienta experimente el aroma calmante de la lavanda y camomila. &bull; Luego aplique agua en la mano y aplique en forma de masaje para crear una espuma. &bull; Utilice un papel facial para remover. Prosiga con una aplicación adicional de agua con el roceador y seque luego con papel facial nuevamente. &bull; Compare las manos . Señale la suavidad, limpieza y acondicionamiento que se siente en la mano.</p>';'1. Micro-Purifying—Gently and quickly “takes your entire day off”—including long wear makeup, impurities and pollution. Used regularly, it helps clear pores for a more refined smoother look. 

2. Micro-Revitalizing—Gentle formula revitalizes with skin conditioners and a relaxing blend of lavender and chamomile help calm and sooth the senses.

3. Micro-Nourishing—Infused with a concentration of micronutrients and minerals that help to deeply nourish, balance and condition.
';'<p>1. Micro-PurificadorSuavemente y rápidamente &quot;remueve el día entero de encima&quot; &mdash;incluyendo maquillaje de larga duración, impurezas y contaminación.Usado regularmente, ayuda a aclarar los poros para una apariencia más refinada y suave. 2. Micro-Revitalizador&mdash;Fórmula suave que revitaliza con acondicionadores de piel y una relajante combinación de lavanda y camomila para ayudar a calmar y suavizar los sentidos. 3. Micro-Nutritiva&mdash;Infusionado con una concentración de micronutrientes y minerales que ayudan a nutrir profundamente, balancear y condicionar la apariencia de la piel.</p>
';'Key technologies:

Created specifically for use at night, this gentle yet powerful cleansing foam is formulated with Essential Skin Minerals, Safflower Seed Oil and Lady’s Thistle that deeply purify, balance and condition skin.';'<p>Tecnologías Principales: Creada específicamente para el uso nocturno, esta suave limpiadora de poderosa formulación en espuma contiene Minerales Esenciales Para La Piel , Aceite De Semilla Safflower y Lady&rsquo;s Thistle que purifican profundamente , balancean y acondicionan la piel.</p>
';'Need a phrase to help you link? Try:

"Because you love ___, I also want to show you ___."

Advanced Night Repair Synchronized Recovery Complex II';'<p>&iquest;Necesitas una frase que te ayude a enlazar?  Trata : &quot;Como le encanta ___, quiero demostrarle ___.&quot; Advanced Night Repair Synchronized Recovery Complex II</p>';;'"Who is it for?" 
All skin types.

"How do I use it?" 
Use every night. Massage a small amount over damp skin. Rinse thoroughly with warm water. 

"Can I use the Advanced Night Micro Cleansing Foam in the morning?"
Yes. While the Advanced Night Micro Cleansing Foam was specifically designed for night to help remove makeup, impurities, and pollution it is gentle enough to be used in the morning should a customer wish to. 

"Does it remove eye makeup?"
The cleansing foam is not formulated for use around the eyes. 

"Why are we calling it a micro cleanser?"
The Advanced Night Micro Cleansing Foam works to remove makeup, dirt, debris and pollution that are micro sized and may not been easily seen.
';'<p>&quot;&iquest;Para quién es?&quot; Todo tipo de piel. &quot;&iquest;Cómo lo uso?&quot; Uselo cada noche. Aplique en la piel un poco húmeda. Enjuague con agua tibia. &quot;&iquest;Puedo usar el Advanced Night Micro Cleansing Foam en la mañana?&quot; Si. Aunque el Advanced Night Micro Cleansing Foam fue específicamente diseñado para la noche para ayudar a remover el maquillaje, las impurezas y la contaminación, es suficientemente suave para usarse en la mañana si la clienta lo desea. &quot;&iquest;Remueve maquillaje de los ojos?&quot; La limpiadora en foam no está formulada para usarse en el area ade los ojos. &quot;&iquest;Por qué lo estamos llamando un micro limpiador??&quot; El Advanced Night Micro Cleansing Foam and Balm trabaja para remover maquillaje , sucio, impurezas y contaminación que tienen un tamaño microscópico que no se puede ver fácilmente.</p>
';;'assets/images/ANR-CleansingFoam.jpg';;;;;;
'
Advanced Night Repair Concentrated Recovery PowerFoil Mask -  es-PR';'Advanced Night Repair ';'Concentrated Recovery PowerFoil Mask';'es';'advanced night repair concentrated recovery powerfoil mask, advanced night repair, mascarilla en aluminio, advanced night repair mask, mascarilla en aluminio, mascarilla, recuperación, mascarilla concentrada de recuperación, mascarilla concentrada, reparación, recuperación, avanzada, advanced night';'Tratamiento';'Primavera 2016';25;;'Our first-ever PowerFoil sheet mask delivers potent repair technologies and penetrates 25Xs faster than a traditional cotton sheet mask. Each mask packette contains nearly half a bottle of Advanced Night Repair’s worth of our exclusive ChronoluxCBTM.  

With this concentrated weekly treatment, skin immediately looks fresher, more translucent and renewed. 
';'<p>La primera mascarilla Power Foil con una tecnologia potente de reparacion que pentra 25X mas rápido que una mascarilla de algodon tradicional. Cada packette contiene casi la mitad del exclusivo ingrediente ChronoluxCBTM de Advanced Night Repair. Con este tratamiento concentrado semanal, la piel se siente inmediatamente fresca, mas translúcida y renovada.</p>';'PowerFoil demonstration samples:

• Remove mask carefully from packet and place the cotton side of mask onto the back of the customer’s hand.
• Leave on for 10 minutes, then remove mask and gently massage any remaining liquid. Compare hands.
• Experience tip: While the mask is sitting, have a Beautiful Skin for Life Conversation with your customer or treat her to our Fatigue Fighter 3 Minute Beauty Technique.
';'<p>Demostración de las muestras de PowerFoil &bull; Remueva la mascarilla del paquete y coloque el lado de algodón hacia la parte posterior de la mano de la clienta. &bull; Déjela aplicada por 10 minutos, luego remueva la mascarilla y aplique el residuo en forma de masaje gentilmente. Compare las manos. &bull; Consejo de Experto: Mientras la mascarilla está aplicada tenga una conversación sobre Una Piel Hermosa Para Toda La Vida o llévele a cabo la técnica de belleza de 3 minutos Combata La Fatiga.</p>';'1. Concentrated Recovery—Resets the look of skin from the visible assaults of the environment and jump starts and renews the look of skin for the week ahead.

2. 25X Faster—This “double matrix” mask helps “drive” the formula 25X faster into skin than a traditional cotton sheet mask.  

3. 2X hyaluronic acid—Delivers a double dose of Advanced Night Repair’s powerful moisture magnet—for optimal repair at night. 
';'<p>1. Recuperación Concentrada&mdash;Refuerza la apariencia de la piel de los signos visbles de ataques ambientales e impulsa y renueva la piel para prepararse para la semana siguiente.</p><p>2. 25X Más Rápido&mdash;Esta mascarilla de&nbsp; &quot;matrix dobre &ldquo;&nbsp; ayuda a que la fórmula lleve sus beneficios&nbsp; 25 veces más rápido en la piel&nbsp; que con una mascarilla convencional de algodón.&nbsp;</p><p>3. 2X ácido hialurónico&mdash;Brinda el doble de la dosis del poderoso magneto de hidratación que se encuentra en Avanced Night Repair &mdash;para una reparación óptima en la noche.</p>
';'Key technologies:

• PowerFoil sheet mask—Innovative “double matrix” mask combines cotton with a foil backing. The cotton side of the mask, which makes contact with your skin, is infused with potent repair technologies while the foil side creates a protective cocoon—proven to help “drive” the formula 25X faster into skin. 

• Each mask packette contains nearly half a bottle of Advanced Night Repair’s worth of our exclusive ChronoluxCB™. 

• 2X Hyaluronic Acid of Advanced Night Repair immerses skin with hydration. Hydrated skin is critical for optimal repair at night.
';'<p>Tecnologías Principales &bull; PowerFoil sheet mask&mdash;Una mascarilla innovadora de composición doble que combina algodón con un soporte de aluminio. El lado de algodón de la mascarilla , que hace contacto con la piel, contiene ponderosas tecnologías de reparación mientras el lado de aluminio crea una capa de protección &ndash; que asegura ayudar a que la fórmula se displace 25 veces más rápido en la piel. &bull; Cada macarilla en packette contiene de nuestro exclusivo ChronoluxCB&trade; la cantidad que lleva la mitad de un frasco de Advanced Night Repair. &bull; 2veces más cantidad de Ácido Hialurónico que Advanced Night Repair se impregna en la piel con hidratación. Una piel hidratada es crucial para una reparación óptima en la noche</p>';'Need a phrase to help you link? Try:

"Because you love ___, I also want to show you ___."

Advanced Night Repair Synchronized Recovery Complex II';'<p>&iquest;Necesitas una frase que te ayude a enlazar?  Trata : &quot;Como le encanta ___, quiero demostrarle ___.&quot; Advanced Night Repair Synchronized Recovery Complex II</p>';;'"Who is it for?"
This weekly concentrated treatment is for any customer looking for extra care and an intensive boost of repair technologies and hydration. 

"What makes this PowerFoil Mask so innovative?"
This innovative PowerFoil mask features a unique “double matrix” design combining cotton with a foil backing which helps to “drive” this concentrated formula 25X faster and deep into skin.

"What is an analogy to explain what 25X faster means?"
To better understand what 25Xs faster means think of it like flying from New York to Hong Kong in just 40 minutes versus 16 hours.
• A flight from New York to Hong Kong is approximately 16 hours.
• Divide 960 minutes (16 hours) by 25 = 38 minutes. 
• So you could approximate that 25X faster is like flying from New York to Hong Kong in just 40 minutes!

"If I use the Concentrated Recovery PowerFoil Mask do I still apply Advanced Night Repair?"
No. On the nights when you use the PowerFoil Mask, you do not need to apply Advanced Night Repair. However, you should use Advanced Night Repair all other nights followed by your moisturizer.

"How do I use it?" 
Apply on clean skin, once a week at night. Remove mask, carefully unfold and apply bottom half first, then top half. Leave on for 10 minutes, then remove mask and gently massage any remaining liquid.

"Can I use it more than once a week?"
It is designed as a weekly treatment mask to jumpstart and renew the look of skin from the visible assaults caused by the environment and today’s modern life. However, it can also be used anytime skin has been exposed to extreme conditions such as weather, travel, or stress as desired.

"Do I need this if I am a long term Advanced Night Repair user?"
Yes, this weekly concentrated high performance foil-backed recovery mask infuses skin with potent repair technologies 25X faster than a traditional sheet mask and a double dose of Hyaluronic Acid (compared to Advanced Night Repair) to help jumpstart and renew the look for the week ahead.  Instantly, skin looks fresher, more translucent and renewed.
 
"Is the Concentrated Recovery PowerFoil Mask a concentrated form of Advanced Night Repair?"
No. This weekly concentrated high performance foil-backed recovery mask is meant to be a complement to Advanced Night Repair to help reset and renew skin from the assaults of modern life for the week ahead. While it contains some of the potent repair technologies of Advanced Night Repair, it has its own unique benefits specific to the mask. 
';'<p>&quot;&iquest;Para quién es?&quot; Este tratamiento concentrado semanal es para cualquier clienta buscando un cuidado adicional y un impulso intensivo de tecnologías de reparación e hidratación. &quot;&iquest;Qué hace que esta Mascarilla Power Foil sea tan inovadora? &quot; Esta innovadora mascarilla Power Foil contiene un mátrix doble con un diseño que combina algodón con aluminio de soporte que ayuda a llevar esta fórmula concentrada 25X veces más rápido y más profundo a la piel. &quot;&iquest;Qué analogía se puede usar para explicar el significado de la rapidez de 25x veces mayor?&quot; Para entender mejor la importancia de la rapidez de 25x veces más, piensa en volar de New York a Hong Kong en 40 minutos en vez de 16 horas. &bull; Un vuelo de New York a Hong Kong es de aproximamente 16 hours. &bull; Divide 960 minutos (16 hours) by 25 = 38 minutes. &bull; Entonces volar 25X más rápido te permitiría llegar a Hong Kong en solo 40 minutos. &quot;Si uso La Mascarilla Concentrated Recovery PowerFoil Mask debo aplicar Advanced Night Repair?&quot; No. En las noches que usa la PowerFoil Mask, no necesita aplicar Advanced Night Repair. Sin embargo , debe usar Advanced Night Repair todas las demás noches seguido de su hidratante. &quot;&iquest;Cómo la uso?&quot; Aplique en la piel seca, una vez a la semana por la noche. Remueva la mascarilla con cuidado, desdoble cuidadosamente y aplique la mitad inferior peimero, luego la superior. Déjela aplicada por 10 minutos, luego remueva la mascarilla y aplique en forma de masaje el residuo del líquido. &quot;&iquest;La puedo usar más de una vez a la semana?&quot; Está diseñada como una mascarilla de tratamiento semanal para ser un impulso y renovar la apariencia de la piel de los ataques visbles causados por el ambiente y la vida moderna. Sin embargo, la puede usar si desea en cualquier momento que la ppiel se haya expuesto a condidiones extremas como el clima, viajes o estrés.</p>

"¿La necesito aún si soy una usuaria regular de  Advanced Night Repair ?"
Si, esta mascarilla semanal concentrada de alto rendimiento le brinda a la piel unas tecnologías poderosas 25X veces más rapidasmente que una mascarilla tradicional y una dosis doble de ácido hialurónico (compardo con Advanced Night Repair) que ayudan a impulsar y renovar la apariencia de la piel para la próxima semana.  Instanáneamente la piel se ve más refrescada, translúcida y renovada. 
 
"La Concentrated Recovery PowerFoil Mask es una fórmula más concentrada de Advanced Night Repair?"
No. esta mascarilla de recuperación semanal concentrada de alto rendimiento apoyada en aluminio es un complemento a  Advanced Night Repair para ayudar a renovar y reestablecer la piel de los ataques de la vida moderna y a enfrentar la semana siguiente. Aunque contiene algunas de las tecnologias reparadoras de Advanced Night Repair, ésta tiene sus propios beneficios únicos a la mascarilla.  



';;'assets/images/ANR-PowerFoilMask.jpg';;;;;;
'
Bronze Goddess Summer Glow Collection-  es-PR';'Bronze Goddess';'Summer Glow Collection ';'es';'bronze goddess summer glow collection, bronze goddess colección, summer glow collection, bronze goddess summer, bronze goddess, resplandor de verano, bronze goddess glow, verano, resplandor, bronceador, iluminador, gelée bronzer, multi-palette, paleta de sombras, paleta, sombras para ojos, bronceador en polvo';'Maquillaje';'Primavera 2016';25;;'A collection of summertime essentials to create the perfect sun-kissed glow. ';'<p>Una colección de productos esenciales para la en Verano para crear ese brillo perfecto de un bronceado sutil.</p>';;;'Bronze Goddess Powder Bronzer 

Light, Medium, Medium Deep, Deep

For best results, apply with Blush Brush 15 using a “3” motion—starting at the center of the forehead, sweeping around to the contours of the cheeks, and finishing at the chin. To complete her golden glow, apply bronzer down the center of her neck and to the collarbones—it’s the perfect finishing touch. 

TIP! Bronzer should never be more than 2 shades darker than the skin’s natural color. 

Bronze Goddess Gelée Bronzer* 
An all-in-one lightweight bronzing balm that gives skin a luminous, sun-kissed healthy glow. 

How to Use: Squeeze a small amount onto back of the hand and apply with a foundation brush or fingertips and apply onto face for an all-over summer glow.

NEW! Bronze Goddess Summer Glow Illuminator* 
Sheer, lightweight liquid instantly illuminates cheeks, brow bones, or gives face an allover glow. Wear it alone or mixed in with your favorite foundation to add luminosity to skin. 

NEW! Bronze Goddess Summer Glow Multi-Palette*
Illuminate, Contour and Blush, this palette provides all the shades to perfectly sculpt and define the look of skin for a naturally glowing and sun-kissed look with soft, shimmering color.

NEW! Bronze Goddess Summer Glow Eyeshadow Palette* 
Shades of summer and seduction. A palette of 6 sunlit shades to highlight, define and dramatize your eyes. Dual-ended brush applicator included. 

NEW! Pure Color Lip and Cheek Summer Glow* 
This dual-ended multi-use stick is the perfect summer staple. One side gives cheeks and lips a burst of revitalized color for a fresh flush. The other side, a high-shine lightweight lip gloss that can be worn alone or on top of lip color.

*Limited Life 







